{
  "_meta": {
    "stage": "challenge",
    "by": "示例",
    "at": "2026-10-14T06:00:00+08:00"
  },
  "taunt_zh": "哼，四条线索，你能排对吗？",
  "taunt_en": "Four clues. Can you solve it?",
  "prop": "sweat",
  "title": "午夜观景台的队伍",
  "body": "艾莎、健太、卢卡、阿米尔，四位小客人排队登上午夜观景台。队首是第1位，队尾是第4位。",
  "answer": "阿米尔 → 艾莎 → 健太 → 卢卡",
  "solution": "艾莎只能在 2 或 3（线索①）。健太不在 1、又在卢卡前面，所以健太只能在 2 或 3，卢卡在健太后面。艾莎在 3 时健太在 2，卢卡在 4，阿米尔在 1，阿米尔和艾莎不挨着，与线索③冲突；所以艾莎在 2，健太 3，卢卡 4，阿米尔 1。唯一解，四条线索缺一不可。",
  "clues": [
    "艾莎不在第1位，也不在第4位。",
    "健太不在第1位。",
    "阿米尔和艾莎挨着站。",
    "健太排在卢卡前面，中间可能隔着别人。"
  ],
  "question": "从队首到队尾，四人依次是谁？"
}
