{
  "_meta": {
    "stage": "14-puzzle",
    "by": "示例",
    "at": "2026-10-14T06:00:00+08:00"
  },
  "taunt_zh": "哼，奶茶的事我还没完！先过我这关！",
  "taunt_en": "Not so fast! Beat me first!",
  "prop": "sweat",
  "title": "🌍 谜题：四国小客人",
  "body": "挪威的艾莎、日本的健太、巴西的卢卡、埃及的阿米尔，四人排成一队领奶茶。",
  "answer": "阿米尔 → 健太 → 艾莎 → 卢卡",
  "solution": "卢卡是第 4（线索③）；艾莎不在 1、4，只能在 2 或 3；健太紧跟阿米尔，两人占相邻两位。艾莎在 2 时阿米尔、健太只能占 3、4，与卢卡冲突；所以艾莎在 3，阿米尔 1、健太 2。唯一解。",
  "clues": [
    "艾莎不排在第一个，也不排在最后一个。",
    "健太紧跟在阿米尔后面，两人之间没有其他人。",
    "卢卡排在最后一个。"
  ],
  "question": "从队首到队尾，四人依次是谁？"
}
